{
  "schema_version": 1,
  "target": "rakoczi1707",
  "title": "Philippe Groffey (?) to Ferenc Rákóczi II (Pompeio Cesoni), 15 October 1707 (DECODE R902)",
  "documents": [
    {
      "id": "R902",
      "read": "read in part",
      "shelfmark": "MNL OL, G15 Caps. C. Fasc. 39, pp. 277-279 (DECODE R902)",
      "date": "15 October 1707",
      "year": 1707,
      "country": "France",
      "route": "Polish-Swedish theatre -> Ferenc Rakoczi II",
      "language": "French",
      "cleartext_in_document": "separate passages",
      "plaintext": {
        "location": ["none"],
        "source": "No prior plaintext found; this project decoded the document with preserved key DECODE R639 (Fasc. 44/08)."
      },
      "length": {
        "tokens": 1108,
        "distinct": 326,
        "unit": "code groups",
        "measured": true,
        "file": "DOC_R902_D1951_1951.txt"
      },
      "transcription": {
        "by": "DECODE",
        "source": "DECODE document D1951",
        "image_quality": "good",
        "notes": "Manual DECODE transcription contains many one-digit errors, joined groups, and ambiguous raised leading digits."
      }
    }
  ],
  "system": {
    "types": ["homophonic", "syllabic", "nomenclator"],
    "summary": "One-part numerical French nomenclator, values 10-560, with homophonic letters, endings, syllables, words, names, places, and nulls.",
    "symbol_kind": "digits",
    "digit_groups": {"width": "2-3", "separation": "dots"},
    "distinct_symbols": 326,
    "diacritics": {"used": false},
    "homophones": {"used": true, "max_per_vowel": 5, "max_per_consonant": 4},
    "nomenclator": {"present": true},
    "nulls": {"present": true, "count": 12},
    "key_order": "partly alphabetical",
    "word_division": "partial",
    "sibling_key": "DECODE R639 / Fasc. 44/08",
    "notes": "Key heading: De Monsieur de Bonac et Graffei."
  },
  "conditions": {
    "prior_solution": {"exists": "no", "where": "DECODE marked R902 non-decrypted", "found": "before attempt", "used": false},
    "inputs": ["images", "transcription", "key from archive", "sibling key", "known plaintext"],
    "attack": "key from archive",
    "human_role": "Supplied access to the authenticated DECODE session and posed the target.",
    "tools": ["DECODE record search", "key scoring", "direct table decoder", "same-key known-plaintext validation"],
    "models": ["gpt-5"],
    "sessions": 1,
    "first_date": "2026-09-20",
    "last_date": "2026-09-20"
  },
  "solution": [
    {"date": "2026-09-20", "kind": "transcription", "what": "Read the clear address A Monsieur / Monsieur Pompeio Cesoni.", "result": "worked"},
    {"date": "2026-09-20", "kind": "sibling key", "what": "Located and applied DECODE R639, Fasc. 44/08, headed De Monsieur de Bonac et Graffei.", "result": "worked"},
    {"date": "2026-09-20", "kind": "control", "what": "Validated the key on same-series known-plaintext documents R852 and R912.", "result": "worked"},
    {"date": "2026-09-20", "kind": "reading", "what": "Recovered 1,020 of 1,108 transcribed groups and read the report in substance.", "result": "partial"},
    {"date": "2026-09-20", "kind": "hypothesis", "what": "Attributed the unsigned report to Philippe Groffey from the key heading, subject, and diplomatic role.", "result": "partial"}
  ],
  "outcome": {
    "method": "read after matching with key from external sources",
    "method_basis": "The key is DECODE R639 (MNL OL G15 Caps. C Fasc. 44/08, 'De Monsieur de Bonac et Graffei'), a separate key record not tied to R902, found by scoring NAH G15 keys and applied to DECODE's digit transcription (1,020 of 1,108 groups); validated on the same-key comparators R852 and R912.",
    "contribution": ["sender or date identified", "catalogue correction"],
    "class": "read in part",
    "gaps": [
      {"item": "R902 (pp. 277-279), ~88 unparsed or impossible groups and the continuous diplomatic text", "blocker": "not-attempted", "detail": "residue is DECODE transcription slips (one-digit errors, joined groups); no fresh group-by-group transcription from the two cipher leaves has been made, though the images were viewable through the project account"}
    ],
    "fraction_read": 0.92,
    "fraction_coherent": 0.72,
    "fraction_read_method": "measured",
    "fraction_read_source": "R902_key08_read.txt: 1,020 of 1,108 parsed DECODE groups have a value in the R639 key (NOTES; 988 of 1,076 whitespace tokens in the file), bracketed [numbers] counted unread.",
    "key": "recovered",
    "grades": {"H": 1020, "C": 0, "M": 0, "I": 88},
    "verification": ["key confirms", "historical consistency"],
    "notes": "Cipher solved. Exact diplomatic edition awaits a fresh manuscript transcription because the existing DECODE digit transcript is noisy. fraction_coherent 0.72 is the earlier session's estimate of how much of the decoded text reads as sense (the key output over DECODE's noisy digits is often broken into syllable fragments); it was not counted."
  }
}
